{
  "run_id": "2026-10-11-no-pilot",
  "searches": [
    {
      "scope_id": "P017",
      "language": "nb",
      "query": "site.greenmountain.no Hamar tre bygg 90 MW opsjon 150",
      "searched_at": "2026-10-11T18:36:20Z",
      "engine": "web.run",
      "action": "search",
      "route": "operator",
      "search_id": "Q001",
      "result_urls": [],
      "outcome": "Submitted in the country batch. Mixed results led to the primary sources recorded in the evidence registry; per-query ranking and attribution were not exposed.",
      "limitations": "Bounded pilot, not exhaustive country discovery. Search language does not guarantee same-language results. Returned URLs are not attributed to an individual query within this batch."
    },
    {
      "scope_id": "P021",
      "language": "nb",
      "query": "site.lefdalmine.com Lefdal 80 200 MW reservasjon strøm",
      "searched_at": "2026-10-11T18:36:20Z",
      "engine": "web.run",
      "action": "search",
      "route": "operator",
      "search_id": "Q002",
      "result_urls": [],
      "outcome": "Submitted in the country batch. Mixed results led to the primary sources recorded in the evidence registry; per-query ranking and attribution were not exposed.",
      "limitations": "Bounded pilot, not exhaustive country discovery. Search language does not guarantee same-language results. Returned URLs are not attributed to an individual query within this batch."
    },
    {
      "scope_id": "NO",
      "language": "en",
      "query": "site.lefdalmine.com 80 MW 200 MW available power",
      "searched_at": "2026-10-11T18:36:20Z",
      "engine": "web.run",
      "action": "search",
      "route": "operator",
      "search_id": "Q003",
      "result_urls": [],
      "outcome": "Submitted in the country batch. Mixed results led to the primary sources recorded in the evidence registry; per-query ranking and attribution were not exposed.",
      "limitations": "Bounded pilot, not exhaustive country discovery. Search language does not guarantee same-language results. Returned URLs are not attributed to an individual query within this batch."
    },
    {
      "search_id": "Q004",
      "scope_id": "P017",
      "language": "en",
      "query": "https://greenmountain.no/data-center/osl-hamar/",
      "searched_at": "2026-10-11T18:43:58Z",
      "engine": "web.run",
      "action": "open",
      "route": "operator",
      "result_urls": [
        "https://greenmountain.no/data-center/osl-hamar/"
      ],
      "outcome": "Second-pass source retrieval; searched within page for Maximum IT Capacity",
      "limitations": "Same-agent source check, not independent review."
    },
    {
      "search_id": "Q005",
      "scope_id": "P017",
      "language": "en",
      "query": "https://greenmountain.no/data-centers/build-to-suit/",
      "searched_at": "2026-10-11T18:43:58Z",
      "engine": "web.run",
      "action": "open",
      "route": "operator",
      "result_urls": [
        "https://greenmountain.no/data-centers/build-to-suit/"
      ],
      "outcome": "Second-pass source retrieval; searched within page for first building",
      "limitations": "Same-agent source check, not independent review."
    },
    {
      "search_id": "Q006",
      "scope_id": "P021",
      "language": "en",
      "query": "https://www.lefdalmine.com/news/lefdal-mine-datacenter-expand-power-capacity-with-60-mw",
      "searched_at": "2026-10-11T18:43:58Z",
      "engine": "web.run",
      "action": "open",
      "route": "operator",
      "result_urls": [
        "https://www.lefdalmine.com/news/lefdal-mine-datacenter-expand-power-capacity-with-60-mw"
      ],
      "outcome": "Second-pass source retrieval; searched within page for 80 MW",
      "limitations": "Same-agent source check, not independent review."
    },
    {
      "search_id": "Q007",
      "scope_id": "P021",
      "language": "en",
      "query": "https://www.lefdalmine.com/data-center/power",
      "searched_at": "2026-10-11T18:43:58Z",
      "engine": "web.run",
      "action": "open",
      "route": "operator",
      "result_urls": [
        "https://www.lefdalmine.com/data-center/power"
      ],
      "outcome": "Second-pass source retrieval; searched within page for expandable",
      "limitations": "Same-agent source check, not independent review."
    }
  ],
  "evidence": [
    {
      "evidence_id": "E001",
      "project_id": "P017",
      "claim_id": "C025",
      "url": "https://greenmountain.no/data-center/osl-hamar/",
      "title": "OSL-Hamar",
      "source_type": "company",
      "publication_date": "",
      "access_date": "2026-10-11",
      "original_language": "en",
      "original_excerpt": "Total IT Capacity",
      "translation": "",
      "locator": "Site fact box; read with initial three completed buildings and five-building IT scope",
      "retrieval_status": "accessible",
      "independence_group": "green-mountain-osl-hamar-campus",
      "supports_fields": [
        "reported_capacity_basis",
        "notes"
      ],
      "confidence": "high",
      "limitations": "Same-campus phase interpretation: the page explicitly describes the campus measure as IT capacity and three completed 30 MW buildings."
    },
    {
      "evidence_id": "E002",
      "project_id": "P017",
      "claim_id": "C025",
      "url": "https://greenmountain.no/data-center/osl-hamar/",
      "title": "OSL-Hamar",
      "source_type": "company",
      "publication_date": "",
      "access_date": "2026-10-11",
      "original_language": "en",
      "original_excerpt": "The initial three buildings are now fully complete and in operation",
      "translation": "",
      "locator": "First site description paragraph",
      "retrieval_status": "accessible",
      "independence_group": "green-mountain-osl-hamar-campus",
      "supports_fields": [
        "capacity_status",
        "notes"
      ],
      "confidence": "high",
      "limitations": "Confirms current operation, not an exact commissioning year for all three buildings."
    },
    {
      "evidence_id": "E003",
      "project_id": "P017",
      "claim_id": "C026",
      "url": "https://greenmountain.no/data-center/osl-hamar/",
      "title": "OSL-Hamar",
      "source_type": "company",
      "publication_date": "",
      "access_date": "2026-10-11",
      "original_language": "en",
      "original_excerpt": "Maximum IT Capacity: 5 x 30 MW",
      "translation": "",
      "locator": "Features, Power and cooling",
      "retrieval_status": "accessible",
      "independence_group": "green-mountain-osl-hamar-campus",
      "supports_fields": [
        "reported_capacity_basis",
        "capacity_qualifier"
      ],
      "confidence": "high",
      "limitations": "Maximum campus IT capacity; not evidence that all five buildings are complete."
    },
    {
      "evidence_id": "E004",
      "project_id": "P017",
      "claim_id": "C026",
      "url": "https://greenmountain.no/data-centers/build-to-suit/",
      "title": "Build-to-Suit Data Center for TikTok",
      "source_type": "company",
      "publication_date": "",
      "access_date": "2026-10-11",
      "original_language": "en",
      "original_excerpt": "90 MW, with the option to scale up to 150 MW.",
      "translation": "",
      "locator": "Build-to-Suit Data Center for TikTok, initial agreement paragraph",
      "retrieval_status": "accessible",
      "independence_group": "green-mountain-osl-hamar-campus",
      "supports_fields": [
        "investment_decision",
        "decision_basis",
        "baseline_scope",
        "baseline_claim_id",
        "baseline_comparable"
      ],
      "confidence": "high",
      "limitations": "An option is conditional; there is no stated execution date for the remaining two buildings."
    },
    {
      "evidence_id": "E005",
      "project_id": "P017",
      "claim_id": "C025",
      "url": "https://greenmountain.no/data-centers/build-to-suit/",
      "title": "Build-to-Suit Data Center for TikTok",
      "source_type": "company",
      "publication_date": "",
      "access_date": "2026-10-11",
      "original_language": "en",
      "original_excerpt": "The first building was officially handed over in November 2023.",
      "translation": "",
      "locator": "Last construction narrative paragraph",
      "retrieval_status": "accessible",
      "independence_group": "green-mountain-osl-hamar-campus",
      "supports_fields": [
        "timing_scope",
        "notes"
      ],
      "confidence": "high",
      "limitations": "First building only; it does not date commissioning of all three initial buildings."
    },
    {
      "evidence_id": "E006",
      "project_id": "P021",
      "claim_id": "C030",
      "url": "https://www.lefdalmine.com/news/lefdal-mine-datacenter-expand-power-capacity-with-60-mw",
      "title": "Lefdal Mine Data Centers expand power capacity with 60 MW",
      "source_type": "company",
      "publication_date": "",
      "access_date": "2026-10-11",
      "original_language": "en",
      "original_excerpt": "increases the available power to the data center from 20 MW to 80 MW",
      "translation": "",
      "locator": "Opening paragraph, 132 kV connection",
      "retrieval_status": "accessible",
      "independence_group": "https://www.lefdalmine.com/news/lefdal-mine-datacenter-expand-power-capacity-with-60-mw",
      "supports_fields": [
        "reported_capacity_basis",
        "measurement_kind",
        "connection_status"
      ],
      "confidence": "high",
      "limitations": "Available grid-fed power is not installed occupied IT/facility capacity; original publication date not shown."
    },
    {
      "evidence_id": "E007",
      "project_id": "P021",
      "claim_id": "C031",
      "url": "https://www.lefdalmine.com/data-center/power",
      "title": "Lefdal Mine Data Centers — Power",
      "source_type": "company",
      "publication_date": "",
      "access_date": "2026-10-11",
      "original_language": "en",